{
  "id": "obstacle-course",
  "name": "Obstacle Course",
  "description": "A few boxes and a post to test collision and sensing against.",
  "objects": [
    {
      "id": "box1",
      "name": "Box 1",
      "transform": { "position": [0.6, 0.0, 0.05] },
      "geometry": { "type": "box", "size": [0.1, 0.1, 0.1] },
      "material": { "color": [0.8, 0.3, 0.3] }
    },
    {
      "id": "box2",
      "name": "Box 2",
      "transform": { "position": [-0.5, 0.4, 0.075] },
      "geometry": { "type": "box", "size": [0.15, 0.15, 0.15] },
      "material": { "color": [0.3, 0.5, 0.8] }
    },
    {
      "id": "post1",
      "name": "Post 1",
      "transform": { "position": [0.0, -0.6, 0.15] },
      "geometry": { "type": "cylinder", "radius": 0.03, "length": 0.3 },
      "material": { "color": [0.3, 0.7, 0.3] }
    }
  ]
}
